{
  "id": "11111111-1111-1111-1111-111111111111",
  "incident_id": "22222222-2222-2222-2222-222222222222",
  "report_id": "33333333-3333-3333-3333-333333333333",
  "offer_id": "44444444-4444-4444-4444-444444444444",
  "status": "in_progress",
  "note": "就近派工，預計今日完成",
  "created_at": "2026-06-16T08:00:00+08:00",
  "updated_at": "2026-06-16T09:30:00+08:00"
}
